{"schemaVersion":2,"status":"ATTACHED","code":0,"injectionAttempted":true,"moduleWasEverLoaded":true,"moduleLoadStateVerified":true,"moduleSnapshotVerified":false,"moduleAbsent":false,"targetProcessExited":false,"targetIdentityVerified":true,"probeReady":true,"stopSucceeded":false,"unloadSafe":false,"moduleUnloaded":false,"moduleResidentInactive":false,"strictUnloadVerified":false,"cleanupRetriable":true,"injectionMode":"PausePrimaryRemoteThreadResume","suspendedThreadCount":1,"primaryThreadId":9200,"extraReferenceRequested":true,"extraReferenceLoaded":true,"extraReferenceNegativeFirstFreeLibraryStillPresent":false,"extraReferenceNegativeNotClaimedUnloaded":false,"extraReferenceReleasedThenModuleAbsent":false}
